{
  "$schema": "http://json-schema.org/draft-07/schema#",
  "$id": "league.schema.json",
  "title": "League",
  "description": "The ENTIRE league state in one object. This is the single save file the whole simulator reads and rewrites. Every engine module takes an object of this shape and returns an updated one. Sub-objects are defined in the sibling schemas (team/player/draft/history) and referenced here.",
  "schemaVersion": 1,
  "type": "object",
  "required": ["schemaVersion", "meta", "settings", "teams", "players"],
  "additionalProperties": true,
  "properties": {
    "schemaVersion": {
      "type": "integer",
      "const": 1,
      "description": "Bump this and write a migration when you make a breaking change to the shape."
    },
    "meta": {
      "type": "object",
      "description": "League-wide clock and identity. The engine reads currentSeason/phase to know where in the yearly cycle it is.",
      "required": ["leagueName", "currentSeason", "currentPhase", "rngSeed"],
      "additionalProperties": true,
      "properties": {
        "leagueName": { "type": "string" },
        "currentSeason": { "type": "integer", "description": "The year currently being played / about to be played." },
        "currentPhase": {
          "type": "string",
          "enum": ["regular_season", "playoffs", "offseason", "draft", "free_agency"],
          "description": "Where in the yearly cycle the league is. Modules advance this."
        },
        "rngSeed": {
          "type": "integer",
          "description": "THE master seed. Every module derives a deterministic sub-stream from this. Same seed + same actions = same league, always."
        },
        "createdAt": { "type": "string" },
        "lastSimulatedSeason": { "type": ["integer", "null"] }
      }
    },
    "settings": {
      "type": "object",
      "description": "Tunable rules for this league. Change these to reshape the sim without touching code.",
      "additionalProperties": true,
      "properties": {
        "salaryCap": { "type": "number", "description": "Soft cap in $M." },
        "minSalary": { "type": "number" },
        "maxRosterSize": { "type": "integer" },
        "meetingsPerMatchup": { "type": "integer", "description": "How many times each pair of teams plays per season." },
        "draftClassSize": { "type": "integer" },
        "playoffTeams": { "type": "integer" }
      }
    },
    "teams": {
      "type": "array",
      "minItems": 2,
      "description": "All franchises. See team.schema.json.",
      "items": { "$ref": "team.schema.json" }
    },
    "players": {
      "type": "array",
      "description": "The MASTER list of all rostered players and free agents. A team's roster is derived by filtering on teamId. See player.schema.json.",
      "items": { "$ref": "player.schema.json" }
    },
    "freeAgents": {
      "type": "array",
      "description": "Ids of players with no team, awaiting a contract. These ids also appear in `players` with teamId=null.",
      "items": { "type": "string" }
    },
    "transactions": {
      "type": "array",
      "description": "Append-only log of roster moves, newest last. Written by the UI and by the engine as moves actually happen — it is a record, never a projection.",
      "items": {
        "type": "object",
        "required": ["id", "type", "season", "at"],
        "additionalProperties": true,
        "properties": {
          "id":     { "type": "string", "description": "Unique id for this entry." },
          "type":   { "type": "string", "enum": ["waive", "sign", "trade", "draft", "release", "extension"] },
          "season": { "type": "integer" },
          "at":     { "type": "string", "description": "ISO timestamp of when the move was made." },
          "teamId": { "type": ["string", "null"] },
          "playerId":   { "type": ["string", "null"] },
          "playerName": { "type": "string", "description": "Denormalised so the log still reads correctly if the player record is later removed." },
          "position": { "type": "string" },
          "salary": { "type": ["number", "null"], "description": "Salary involved in the move, in $M." },
          "years":  { "type": ["integer", "null"] },
          "detail": { "type": "string", "description": "Short human-readable summary." }
        }
      }
    },
    "draft": {
      "description": "Current draft class + order. See draft.schema.json.",
      "$ref": "draft.schema.json"
    },
    "history": {
      "description": "Permanent league record. See history.schema.json.",
      "$ref": "history.schema.json"
    },
    "capReport": {
      "type": "array",
      "description": "Advisory, regenerated by updateContracts.js. Per-team committed salary and cap space. Safe to ignore or delete; it's a convenience cache, not source data.",
      "items": { "type": "object" }
    }
  }
}
