{
  "schemaVersion": 1,
  "meta": {
    "leagueName": "Hoops Dynasty Demo League",
    "currentSeason": 2025,
    "currentPhase": "regular_season",
    "rngSeed": 424242,
    "createdAt": "2025-01-01",
    "lastSimulatedSeason": null
  },
  "settings": {
    "salaryCap": 140,
    "minSalary": 1,
    "maxRosterSize": 15,
    "meetingsPerMatchup": 4,
    "draftClassSize": 18,
    "playoffTeams": 4
  },
  "teams": [
    {
      "id": "BAY",
      "city": "Bay City",
      "name": "Breakers",
      "conference": "West",
      "championships": 0
    },
    {
      "id": "GRN",
      "city": "Granite",
      "name": "Miners",
      "conference": "West",
      "championships": 0
    },
    {
      "id": "HAR",
      "city": "Harbor",
      "name": "Sharks",
      "conference": "East",
      "championships": 1
    },
    {
      "id": "CAP",
      "city": "Capital",
      "name": "Sentinels",
      "conference": "East",
      "championships": 0
    },
    {
      "id": "RDG",
      "city": "Ridgeway",
      "name": "Rovers",
      "conference": "West",
      "championships": 0
    }
  ],
  "players": [
    {
      "id": "p_001",
      "name": "Oscar Olsson",
      "position": "PG",
      "secondaryPosition": null,
      "age": 21,
      "teamId": "BAY",
      "heightIn": 73,
      "weightLb": 162,
      "archetype": "combo_guard",
      "archetypeLabel": "Combo Guard",
      "birthplace": {
        "city": "Malmo",
        "region": null,
        "country": "Sweden"
      },
      "nationality": "Sweden",
      "secondaryNationality": null,
      "namingOrigin": "nordic",
      "gender": "male",
      "college": "Ashford",
      "attributes": {
        "strength": 55,
        "speed": 91,
        "agility": 92,
        "vertical": 82,
        "stamina": 81,
        "endurance": 74,
        "threePoint": 90,
        "midRange": 88,
        "layup": 80,
        "shotIQ": 82,
        "dunk": 84,
        "postControl": 47,
        "freeThrow": 89,
        "passing": 87,
        "ballHandling": 93,
        "passingIQ": 91,
        "perimeterDefense": 85,
        "interiorDefense": 49,
        "defensiveIQ": 81,
        "steal": 85,
        "block": 32,
        "defensiveRebound": 55,
        "offensiveRebound": 64
      },
      "statsHistory": [],
      "overall": 80,
      "potential": 85,
      "contract": {
        "salary": 18,
        "yearsRemaining": 3,
        "type": "standard",
        "playerOption": false,
        "teamOption": false
      }
    },
    {
      "id": "p_002",
      "name": "Demetrius Coleman",
      "position": "SG",
      "secondaryPosition": null,
      "age": 29,
      "teamId": "BAY",
      "heightIn": 77,
      "weightLb": 229,
      "archetype": "sharpshooter",
      "archetypeLabel": "Sharpshooter",
      "birthplace": {
        "city": "Akron",
        "region": "OH",
        "country": "USA"
      },
      "nationality": "USA",
      "secondaryNationality": null,
      "namingOrigin": "africanAmerican",
      "gender": "male",
      "college": "Redstone",
      "attributes": {
        "strength": 70,
        "speed": 70,
        "agility": 73,
        "vertical": 69,
        "stamina": 65,
        "endurance": 71,
        "threePoint": 86,
        "midRange": 86,
        "layup": 63,
        "shotIQ": 85,
        "dunk": 52,
        "postControl": 34,
        "freeThrow": 89,
        "passing": 79,
        "ballHandling": 74,
        "passingIQ": 78,
        "perimeterDefense": 69,
        "interiorDefense": 44,
        "defensiveIQ": 80,
        "steal": 76,
        "block": 54,
        "defensiveRebound": 70,
        "offensiveRebound": 58
      },
      "statsHistory": [],
      "overall": 71,
      "potential": 71,
      "contract": {
        "salary": 12,
        "yearsRemaining": 1,
        "type": "standard",
        "playerOption": false,
        "teamOption": false
      }
    },
    {
      "id": "p_003",
      "name": "Ricardo Foster",
      "position": "SF",
      "secondaryPosition": "SG",
      "age": 19,
      "teamId": "BAY",
      "heightIn": 78,
      "weightLb": 222,
      "archetype": "two_way_wing",
      "archetypeLabel": "Two-Way Wing",
      "birthplace": {
        "city": "Toulouse",
        "region": null,
        "country": "France"
      },
      "nationality": "France",
      "secondaryNationality": null,
      "namingOrigin": "caribbeanAmerican",
      "gender": "male",
      "college": "Kingsbury",
      "attributes": {
        "strength": 66,
        "speed": 84,
        "agility": 79,
        "vertical": 80,
        "stamina": 76,
        "endurance": 78,
        "threePoint": 75,
        "midRange": 67,
        "layup": 71,
        "shotIQ": 65,
        "dunk": 79,
        "postControl": 32,
        "freeThrow": 67,
        "passing": 74,
        "ballHandling": 76,
        "passingIQ": 60,
        "perimeterDefense": 81,
        "interiorDefense": 60,
        "defensiveIQ": 74,
        "steal": 77,
        "block": 55,
        "defensiveRebound": 64,
        "offensiveRebound": 78
      },
      "statsHistory": [],
      "overall": 71,
      "potential": 80,
      "contract": {
        "salary": 13,
        "yearsRemaining": 3,
        "type": "standard",
        "playerOption": false,
        "teamOption": false
      }
    },
    {
      "id": "p_004",
      "name": "Luke Green",
      "position": "PF",
      "secondaryPosition": "C",
      "age": 32,
      "teamId": "BAY",
      "heightIn": 83,
      "weightLb": 249,
      "archetype": "stretch_four",
      "archetypeLabel": "Stretch Four",
      "birthplace": {
        "city": "Camden",
        "region": "NJ",
        "country": "USA"
      },
      "nationality": "USA",
      "secondaryNationality": null,
      "namingOrigin": "anglo",
      "gender": "male",
      "college": "Summit College",
      "attributes": {
        "strength": 70,
        "speed": 48,
        "agility": 60,
        "vertical": 68,
        "stamina": 65,
        "endurance": 74,
        "threePoint": 78,
        "midRange": 87,
        "layup": 78,
        "shotIQ": 79,
        "dunk": 57,
        "postControl": 68,
        "freeThrow": 81,
        "passing": 67,
        "ballHandling": 62,
        "passingIQ": 71,
        "perimeterDefense": 72,
        "interiorDefense": 65,
        "defensiveIQ": 79,
        "steal": 68,
        "block": 68,
        "defensiveRebound": 77,
        "offensiveRebound": 71
      },
      "statsHistory": [],
      "overall": 71,
      "potential": 71,
      "contract": {
        "salary": 12,
        "yearsRemaining": 2,
        "type": "standard",
        "playerOption": false,
        "teamOption": false
      }
    },
    {
      "id": "p_005",
      "name": "Beckett Ward",
      "position": "C",
      "secondaryPosition": "PF",
      "age": 20,
      "teamId": "BAY",
      "heightIn": 82,
      "weightLb": 255,
      "archetype": "playmaking_big",
      "archetypeLabel": "Playmaking Big",
      "birthplace": {
        "city": "Akron",
        "region": "OH",
        "country": "USA"
      },
      "nationality": "USA",
      "secondaryNationality": null,
      "namingOrigin": "anglo",
      "gender": "male",
      "college": "Overseas Professional",
      "attributes": {
        "strength": 70,
        "speed": 56,
        "agility": 52,
        "vertical": 51,
        "stamina": 63,
        "endurance": 58,
        "threePoint": 51,
        "midRange": 51,
        "layup": 66,
        "shotIQ": 72,
        "dunk": 65,
        "postControl": 75,
        "freeThrow": 49,
        "passing": 65,
        "ballHandling": 57,
        "passingIQ": 56,
        "perimeterDefense": 54,
        "interiorDefense": 69,
        "defensiveIQ": 62,
        "steal": 58,
        "block": 65,
        "defensiveRebound": 67,
        "offensiveRebound": 77
      },
      "statsHistory": [],
      "overall": 63,
      "potential": 77,
      "contract": {
        "salary": 5,
        "yearsRemaining": 1,
        "type": "rookie",
        "playerOption": false,
        "teamOption": false
      }
    },
    {
      "id": "p_006",
      "name": "Mantas Butkus",
      "position": "PF",
      "secondaryPosition": "C",
      "age": 28,
      "teamId": "BAY",
      "heightIn": 84,
      "weightLb": 275,
      "archetype": "athletic_finisher",
      "archetypeLabel": "Athletic Finisher",
      "birthplace": {
        "city": "Klaipeda",
        "region": null,
        "country": "Lithuania"
      },
      "nationality": "Lithuania",
      "secondaryNationality": null,
      "namingOrigin": "lithuanian",
      "gender": "male",
      "college": "Lakeshore Tech",
      "attributes": {
        "strength": 84,
        "speed": 60,
        "agility": 55,
        "vertical": 61,
        "stamina": 62,
        "endurance": 57,
        "threePoint": 24,
        "midRange": 45,
        "layup": 68,
        "shotIQ": 53,
        "dunk": 77,
        "postControl": 66,
        "freeThrow": 42,
        "passing": 43,
        "ballHandling": 44,
        "passingIQ": 52,
        "perimeterDefense": 46,
        "interiorDefense": 80,
        "defensiveIQ": 64,
        "steal": 58,
        "block": 79,
        "defensiveRebound": 78,
        "offensiveRebound": 80
      },
      "statsHistory": [],
      "overall": 63,
      "potential": 63,
      "contract": {
        "salary": 4,
        "yearsRemaining": 2,
        "type": "vet_min",
        "playerOption": false,
        "teamOption": false
      }
    },
    {
      "id": "p_007",
      "name": "Xavier Jackson",
      "position": "PF",
      "secondaryPosition": "C",
      "age": 34,
      "teamId": "BAY",
      "heightIn": 83,
      "weightLb": 272,
      "archetype": "two_way_big",
      "archetypeLabel": "Two-Way Big",
      "birthplace": {
        "city": "Miami",
        "region": "FL",
        "country": "USA"
      },
      "nationality": "USA",
      "secondaryNationality": null,
      "namingOrigin": "africanAmerican",
      "gender": "male",